{
  "$schema": "https://json-schema.org/draft/2020-12/schema",
  "title": "pgf-content-baseline.schema.json",
  "type": "object",
  "required": [
    "baseline_release",
    "content_commit",
    "scope",
    "files"
  ],
  "properties": {
    "baseline_release": {
      "type": "string",
      "minLength": 1
    },
    "content_commit": {
      "type": "string",
      "minLength": 1
    },
    "scope": {
      "type": "string",
      "minLength": 1
    },
    "files": {
      "type": "array",
      "minItems": 32,
      "maxItems": 32,
      "items": {
        "type": "object",
        "required": [
          "path",
          "sha256"
        ],
        "properties": {
          "path": {
            "type": "string",
            "minLength": 1,
            "pattern": "^PGF/[0-9]{2}_[A-Za-z0-9_]+\\.md$"
          },
          "sha256": {
            "type": "string",
            "minLength": 1,
            "pattern": "^[0-9a-f]{64}$"
          }
        },
        "additionalProperties": false
      }
    }
  },
  "additionalProperties": false
}
